issueId,issue_number,url,user,like,dislike,laugh,hooray,confused,heart,body
349478119,27047,https://api.github.com/repos/twbs/bootstrap/issues/27047,don-spyker,1,0,0,0,0,0,fix of xss issues that have been fixed in v.x already fix of two additional xss issuesfixes cve--fixes cve--fixes fixes
348449437,27035,https://api.github.com/repos/twbs/bootstrap/issues/27035,MartijnCuppens,1,0,0,0,0,0,closes implementation drawer modals i used this hack to make sure the modal-footer sticks to the bottom in ie i wrapped this in a media query to prevent strange behaviour on mobile browsers see screenshot here ie fix:@media all and ms-high-contrast none ms-high-contrast active min-height vh;} side modals can be positioned on the left and right side of the screen and are compatible with the sizing classes
348425844,27033,https://api.github.com/repos/twbs/bootstrap/issues/27033,MartijnCuppens,10,0,0,0,0,2,i was recently working on a project where i themed a bootstrap modal as a side drawer i made an implementation that is compatible with the modal sizing classes maybe this is something thats nice to have in bootstrap by default?demo incomming
348412809,27032,https://api.github.com/repos/twbs/bootstrap/issues/27032,rostovsales,0,0,0,0,1,0,navbar-nav-scroll narrows to the width of the screen at iphone s elements run over each other problem at page and
347705855,27021,https://api.github.com/repos/twbs/bootstrap/issues/27021,MartijnCuppens,1,0,0,0,0,2,closes this pr adds a hand cursor for all buttons adds enable-hand-cursor-for-buttons variable which allows developers to still use the default cursor for all buttons adds a reset button example to the reboot page moved all the separated declarations to scss/_reboot.scss
346911485,27015,https://api.github.com/repos/twbs/bootstrap/issues/27015,XhmikosR,1,0,0,0,0,0,johann-s do not merge please@mdo please confirm.refs
346764550,27011,https://api.github.com/repos/twbs/bootstrap/issues/27011,Ruffio,1,0,0,0,0,0,i was thinking of using the floating label on my website but it appears to have been changed i think that the changes happened when was released and a fixed height of px was introduced as it goes from px calculated to px set):! image
346495300,27008,https://api.github.com/repos/twbs/bootstrap/issues/27008,MartijnCuppens,3,0,0,0,0,0,the ssl certificate of the useiconic.com is expired since july we link to this site in the icons docs page maybe its safer to link to the github project page
345920470,26997,https://api.github.com/repos/twbs/bootstrap/issues/26997,MartijnCuppens,2,0,0,0,0,0,closes see
345914995,26996,https://api.github.com/repos/twbs/bootstrap/issues/26996,MartijnCuppens,1,0,0,0,0,0,pseudo elements are used to increase the hit area by px on top and bottom but this can also be done with transparent borders which saves a bit css.demo
345569640,26989,https://api.github.com/repos/twbs/bootstrap/issues/26989,mdo,8,0,0,0,0,0,img width alt=screen shot at pm src
344223375,26956,https://api.github.com/repos/twbs/bootstrap/issues/26956,innabauman,1,0,0,0,0,0,cherry picked from commit f
344183039,26955,https://api.github.com/repos/twbs/bootstrap/issues/26955,thiagoesser,1,0,0,0,0,0,just like in issue only applied to modal-footer if you set a background-color on the modal-footer you get square corners at the bottom of the modal window the background-color covers the rounded corners version of bootstrap v operating system and version macos high sierra v browser and version v
344103035,26951,https://api.github.com/repos/twbs/bootstrap/issues/26951,mdo,3,0,0,0,0,3,lets get back to master being our default branch this might screw a ton of things up so holler at me if we should hold off im hoping to do this alongside v ensure v-dev has everything from master delete existing master switch to v-dev then git co b master push new master branch delete v-dev and then the docs and settings make master default branch again update links across docs update links across readme
343860388,26949,https://api.github.com/repos/twbs/bootstrap/issues/26949,mdo,2,0,0,0,0,0,bumps all the versions across our files for the morning release
343852348,26948,https://api.github.com/repos/twbs/bootstrap/issues/26948,vepanimas,1,0,0,0,0,0,popperjs can position poppers in a fixed mode i think this feature could be useful and it would be great to support it
343752375,26946,https://api.github.com/repos/twbs/bootstrap/issues/26946,Johann-S,0,0,0,1,0,0,fix jquery popper.js path in our visual tests and fix the accordion in our modal test
343285786,26938,https://api.github.com/repos/twbs/bootstrap/issues/26938,vepanimas,4,0,0,1,0,1,there are a lot of issues related to incomplete dropdown alignment support in this pr i added support for all popperjs placement options.two new classes were introduced dropdown-menu-center for all directions and dropdown-menu-bottom only for dropleft and dropright ).i am open to discussion feel free to comment
343184091,26934,https://api.github.com/repos/twbs/bootstrap/issues/26934,sts-ryan-holton,0,1,0,0,0,0,i think having the tabs functionality inside the current navs component is a little confusing especially as theyre listed further down the page.what we should have is an actual tabs component as they do in fact act like tabs rather than a navigation as outlined in the docs
342391741,26916,https://api.github.com/repos/twbs/bootstrap/issues/26916,MartijnCuppens,1,0,0,0,0,0,fixes what happend? box-shadow of custom file inputs are added to the label instead of the input itself the z-index of the label was increased to overlap buttons see but the z-index of the custom file input didnt increase therefore the label was clicked and this focuses the file input but didnt trigger the file browser. the fix ive increased the z-index of the custom file input so that the file input works again.demo in latest chrome/firefox/ie/edge/safarikudos to ysds for adding the ticket number in his commit this made it a lot easier to find out what was wrong
342294680,26912,https://api.github.com/repos/twbs/bootstrap/issues/26912,giarico,2,0,0,0,0,0,using the class custom-file-input the browse button isnt working anymore.you can also try from the documentation link on the latest version of chrome and ie
342147546,26910,https://api.github.com/repos/twbs/bootstrap/issues/26910,ysds,3,0,0,0,0,0,this pr fix an issue similar to
341445478,26891,https://api.github.com/repos/twbs/bootstrap/issues/26891,eqx-devops,1,0,0,0,0,0,getting error in console for collapse javascript plugin collapse not working as expected it was working days before uncaught typeerror cannot read property queryselectorall of nullversion used on accordion bay street
341327868,26883,https://api.github.com/repos/twbs/bootstrap/issues/26883,sts-ryan-holton,6,0,0,0,0,0,this is a feature request possibly for bootstrap and onwards whilst the website does have a dropdown in the top right for the latest versions of each version of bootstrap this isnt always going to facilitate for older versions of bootstrap or versions which are being used in some themes these days see here as an example current docs selector:
341200043,26878,https://api.github.com/repos/twbs/bootstrap/issues/26878,nifte,11,0,0,0,0,0,a new change in causes inline svg icons to become unaligned.the code in question scss/_reboot.scss line svg:not(:root overflow hidden vertical-align middle line the issue can be seen in the following examples: version icons aligned icons not aligned
340997404,26876,https://api.github.com/repos/twbs/bootstrap/issues/26876,lschnetler,3,0,0,0,0,0,when building with the latest version we came across this issue with the prod aot flags: error in node_modules/bootstrap/scss/bootstrap.scss m m m m m mmodule build failed modulebuilderror module build failed browserslisterror unknown browser query dead  m m m m m m at home/default/workspace/galleries/sybrin.ui.modules.appbuilder/node_modules/browserslist/index.js:: m m m m m m at array.reduce anonymous>) m m m m m m at resolve home/default/workspace/galleries/sybrin.ui.modules.appbuilder/node_modules/browserslist/index.js::) m m m m m m at browserslist home/default/workspace/galleries/sybrin.ui.modules.appbuilder/node_modules/browserslist/index.js::) m m m m m m at browsers.parse home/default/workspace/galleries/sybrin.ui.modules.appbuilder/node_modules/autoprefixer/lib/browsers.js::) m m m m m m at new browsers home/default/workspace/galleries/sybrin.ui.modules.appbuilder/node_modules/autoprefixer/lib/browsers.js::) m m m m m m at loadprefixes home/default/workspace/galleries/sybrin.ui.modules.appbuilder/node_modules/autoprefixer/lib/autoprefixer.js::) m m m m m m at plugin home/default/workspace/galleries/sybrin.ui.modules.appbuilder/node_modules/autoprefixer/lib/autoprefixer.js::) m m m m m m at lazyresult.run home/default/workspace/galleries/sybrin.ui.modules.appbuilder/node_modules/postcss/lib/lazy-result.js::) m m m m m m at lazyresult.asynctick home/default/workspace/galleries/sybrin.ui.modules.appbuilder/node_modules/postcss/lib/lazy-result.js::) m m m m m m at home/default/workspace/galleries/sybrin.ui.modules.appbuilder/node_modules/postcss/lib/lazy-result.js:: m m m m m m at anonymous> m m m m m m at runloaders home/default/workspace/galleries/sybrin.ui.modules.appbuilder/node_modules/webpack/lib/normalmodule.js::) m m m m m m at home/default/workspace/galleries/sybrin.ui.modules.appbuilder/node_modules/loader-runner/lib/loaderrunner.js:: m m m m m m at home/default/workspace/galleries/sybrin.ui.modules.appbuilder/node_modules/loader-runner/lib/loaderrunner.js:: m m m m m m at context.callback home/default/workspace/galleries/sybrin.ui.modules.appbuilder/node_modules/loader-runner/lib/loaderrunner.js::) m m m m m m at promise.resolve.then.then.catch home/default/workspace/galleries/sybrin.ui.modules.appbuilder/node_modules/postcss-loader/lib/index.js::) m m m m m m at anonymous> m m mbuild step execute shell marked build as failure
340208128,26855,https://api.github.com/repos/twbs/bootstrap/issues/26855,He3lixxx,1,0,0,0,0,0,in a toggle button group if you select a button using the keyboard the underlying selection of the radio inputs is not changed thus if you have these buttons in a form and submit the form the user might submit an unintended selection.i guess this is related to i added a comment there but there was no reaction and are possibly related but no duplicates imo steps to reproduce in a toggle button group click on one button with the mouse then change your selection with the arrow keys left right expected result:the radio input that represents the now selected button is checked actual result:the radio input selection is not changed although the visuals indicate that it was changed tested in firefox firefox and chrome example code you can reproduce the issue here the html code is copied from the docs i only added css to remove the clip property on the inputs so you can see which input is selected
339971907,26848,https://api.github.com/repos/twbs/bootstrap/issues/26848,jarstelfox,1,0,0,0,0,0,fixes after doing some digging it looks like popover was previously checking for destroy but this has been renamed to dispose in v
339966631,26847,https://api.github.com/repos/twbs/bootstrap/issues/26847,jarstelfox,1,0,0,0,0,0,if the element a popover is attached to has a title manually calling popover(dispose causes the pop over to have a title in the pop over which matches the title attribute of the element.this can actually replace the title which is specified in the options see codepen version
339858885,26846,https://api.github.com/repos/twbs/bootstrap/issues/26846,wtorsi,1,0,0,0,0,0,hi the function is very great thanks but it will be much more convenient if we add some arguments like below what do you think function color-yiq($color dark yiq-text-dark light yiq-text-light r red($color g green($color b blue($color yiq r g b if yiq yiq-contrasted-threshold return dark else return light
339501426,26835,https://api.github.com/repos/twbs/bootstrap/issues/26835,Andrey847,1,0,0,0,0,0,for some reasons dropdown periodically doesnt work.i debugged and found that problem is in dropdown._clearmenus method of boostrap.js v row after this row was commented dropdown works fine.dropdown html asp.net core razor): html
339275943,26825,https://api.github.com/repos/twbs/bootstrap/issues/26825,mdo,2,0,0,0,0,0,replacement for that adds documentation.closes fixes
339199653,26821,https://api.github.com/repos/twbs/bootstrap/issues/26821,mdo,2,0,0,0,0,0,takes and adds some fixes and tweaks
339139843,26818,https://api.github.com/repos/twbs/bootstrap/issues/26818,hrahimi270,3,0,0,0,0,1,hi there im hossein from iran.why dont you develop rtl version of bootstrap ?there is a lot of websites that use bootstrap but they make it rtl theme selfs . when they make it rtl there will be a lot of problems if you have problems with iran develop it for arab countries or any rtl language country which you have no problem.please release the rtl version of bootstrap in v.regards
338312153,26803,https://api.github.com/repos/twbs/bootstrap/issues/26803,ysds,4,0,0,0,0,0,use the flex-fill class on a series of sibling elements to force them into equal widths while taking up all available horizontal space especially useful for equal-width or justified navigation.this document might cause misunderstanding.they are not the same width they actually depend on the width of their content.demo would like to make a pr but i am not a native speaker so i ask for someones help
336997722,26781,https://api.github.com/repos/twbs/bootstrap/issues/26781,DM2489,1,0,0,0,0,0,printing in ie is broken after the first page displaying no content.chrome:! chrome ie
336883670,26778,https://api.github.com/repos/twbs/bootstrap/issues/26778,pajind,1,0,0,0,0,0,tested on both edge and chrome.checkbox and radio buttons are not accessible when pressing the tab key and skips it
336337537,26771,https://api.github.com/repos/twbs/bootstrap/issues/26771,MartijnCuppens,2,0,0,0,0,0,js maps were added in but theyre also listed on this page page.this pr includes readme remove css from source maps getting started add js source maps reorder files docs update
336272109,26769,https://api.github.com/repos/twbs/bootstrap/issues/26769,EphraimB,0,1,0,0,0,0,the bootstrap homepage is showing the latest version as beta when the latest version is
336152967,26767,https://api.github.com/repos/twbs/bootstrap/issues/26767,Johann-S,5,0,0,1,0,0,finally i succeed to achieve that with that pr folks will be able to choose which plugins they want to import and not all of our plugins. examples: *importing util* jsimport from jquery;import util from bootstrap/js/dist/util; *importing popover* jsimport from jquery;import popper.js;import bootstrap/js/dist/tooltip;import bootstrap/js/dist/popover; this pr would help a lot in that case x update our docsfixes
336095063,26766,https://api.github.com/repos/twbs/bootstrap/issues/26766,XhmikosR,1,0,0,0,0,0,shouldnt change anything where its placed now
335695807,26760,https://api.github.com/repos/twbs/bootstrap/issues/26760,szabbenjamin,1,0,0,0,0,0,open the page which contains a link to bootstrap modal.scroll down until the chrome address bar goes to hide.click the link which open modal.try to inspect an element in this modal you have a great chance to see the issue.i attach the result an existing issue with bs and i use with chrome on huawei p pro android i tried this on chrome canary version canary cant solve this problem
335602972,26759,https://api.github.com/repos/twbs/bootstrap/issues/26759,philcon93,11,0,0,4,0,4,"hey all,i wanted to see what everyone thought about updating the existing form-validation-state forms.scss to use maps or another method if you got one).i am using the validation states on a checkout form and when the forms gets the class was-validated it makes the form look like an tacky christmas tree my users do not need to have the positive valid feedback a lot of the form elements are optional with no patterns so bootstrap the constraint validation api intepretated that as a valid input so it displays that all attention focusing green i shouldnt be forced to add in those html attributes because of the limitation of the css framework either i cant update the valid include of form-validation-state to use a different colour either as it changes input borders and labels to the same colour which are different colours by default and in my design what i propose is to give developers the ability to remove these if desired e.g add a map and then loop that map: $form-validation default;$form-validation map-merge valid form-feedback-valid-color invalid form-feedback-invalid-color form-validation);@each type value in form-validation include form-validation-state($type value);} then developers could easier remove one if needed: $form-validation map-remove($form-validation valid); this isnt so developers can add custom validation states such as warning but to give the ability to remove the existing states i really dont want to but i am going to have use my own custom version of forms.scss which doesnt have include form-validation-state(valid form-feedback-valid-color or probably the solution stated above.i would love to know what you all think,cheers"
335136747,26751,https://api.github.com/repos/twbs/bootstrap/issues/26751,bauereileen01,1,0,0,0,0,0,abide is an html form validation library that supports the native api by using patterns and required attributes to enable validation with abide add the data-abide attribute to your form element then add the required attribute to each input that you want to require additionally you can define a pattern to define restraints on what users can input.name valid example or format alpha foundationalpha_numeric asauceinteger number card visa amex mastercardcvv or email foundation@zurb.comurl zurb.comdatetime yyyy-mm-ddthh:mm:sstzddate yyyy-mm-ddtime hh:mm:ssdateiso not sure yetmonth_day_year mm/dd/yyyycolor fff or ffffff
334739024,26743,https://api.github.com/repos/twbs/bootstrap/issues/26743,jdanil,1,0,0,0,0,0,nest modal styling directly under modal-open to avoid issues when bootstrap is nested.fixes
334545467,26740,https://api.github.com/repos/twbs/bootstrap/issues/26740,Jandoria,1,0,0,0,0,0,hello this is my first issue i hope i havent missed anything out components dropdown bootstrap version it would make sense to be able to put split dropdowns as and buttons into the navbar but they both behave strangely compared to the simple dropdown when the navbar is collapsed.here confirmed i would like to propose a pr i already fixed the issue in my local app my solution will be to look for the parent of the parent if the menu selector isnt found in its parent thing that will happend with the btn-group because the dropdown-menu is and i think it should be outside said group
334391361,26734,https://api.github.com/repos/twbs/bootstrap/issues/26734,ysds,1,0,0,0,0,0,set the visibility of elements with our visibility utilities these do not modify the display value at all and are helpful for hiding content from most users but still keeping them for screen readers. the last description is correct the visibility mdn describe using a visibility value of hidden on an element will remove it from the accessibility tree this will cause the element and all its descendant elements to no longer be announced by screen reading technology
334168228,26729,https://api.github.com/repos/twbs/bootstrap/issues/26729,MartijnCuppens,1,0,0,0,0,0,closes added dist folder reordered files added map files for in js folder
334018049,26728,https://api.github.com/repos/twbs/bootstrap/issues/26728,harastaivan,3,0,0,0,0,0,in readme you have section whats included and there is this tree structure in there: bootstrap/ css/ bootstrap.css bootstrap.css.map bootstrap.min.css bootstrap.min.css.map bootstrap-grid.css bootstrap-grid.css.map bootstrap-grid.min.css bootstrap-grid.min.css.map bootstrap-reboot.css bootstrap-reboot.css.map bootstrap-reboot.min.css bootstrap-reboot.min.css.map js bootstrap.bundle.js bootstrap.bundle.min.js bootstrap.js bootstrap.min.js but i think it should be like this: bootstrap/ dist css bootstrap.css bootstrap.css.map bootstrap.min.css bootstrap.min.css.map bootstrap-grid.css bootstrap-grid.css.map bootstrap-grid.min.css bootstrap-grid.min.css.map bootstrap-reboot.css bootstrap-reboot.css.map bootstrap-reboot.min.css bootstrap-reboot.min.css.map js bootstrap.bundle.js bootstrap.bundle.min.js bootstrap.js bootstrap.min.js right?please correct me if im wrong but i didnt find the bootstrap.css file in bootstrap/css directory but in bootstrap/dist/css and i think it could be confusing for others not just me
333704816,26722,https://api.github.com/repos/twbs/bootstrap/issues/26722,mohamedragaey,4,0,0,0,0,0,adding rtl support for bootstrap
333621216,26720,https://api.github.com/repos/twbs/bootstrap/issues/26720,rohan-koli,11,0,0,0,0,0,exit code of fatal unable to access transfer closed with outstanding read data remaining additional error details fatal unable to access transfer closed with outstanding read data remaining build step execute shell marked build as failure
333293288,26719,https://api.github.com/repos/twbs/bootstrap/issues/26719,juanmaguitar,1,0,0,0,0,0,issue description components tooltip bootstrap version what is happening?if the tooltip is set with some delay on hide clicking outside doesnt close it what should be happening?clicking outside the tooltip should close it
333071177,26718,https://api.github.com/repos/twbs/bootstrap/issues/26718,Johann-S,2,0,0,2,0,2,with this pr its time to to rewrite our doc without jquery woot woot our unit test and coverage are fixed so now its testing time/cc xhmikosr bardiharborow
332997855,26716,https://api.github.com/repos/twbs/bootstrap/issues/26716,sts-ryan-holton,2,0,0,0,0,0,how many times have you come across a bunch of content within a div or an article tag with a bunch of p ul and possibly even headings and thought to yourself if only there was a simple classname i can add to the div that would prevent me having to add specific classes to all of these elements?this is an issue ive come across and whilst im sure bootstrap provides some base default styling im not totally convinced that this is appropriate in most projects.i was thinking this...to add a new component under the components heading on the docs called something like content the purpose of this component is to provide a simple method for styling elements within a div or article element all the user would need to do is add a class called content to their parent element and elements within would be styled i was thinking of adding support for the following html elements p paragraphs ul ol and dl lists h to h headings blockquote quotes em b and strong tags table with relevant child elements of a table_whats peoples opinion on this
331819286,26709,https://api.github.com/repos/twbs/bootstrap/issues/26709,ipawelek,1,0,0,0,0,0,when accessing getbootstrap.com with the vivaldi browser chromium-based the most recent version listed is chrome firefox safari etc are displaying the correct version.i have attached a screenshot for your review.! efbba-fc-a-aca-dadabe
331728696,26708,https://api.github.com/repos/twbs/bootstrap/issues/26708,MartijnCuppens,2,0,0,0,0,0,inkscape has added some redundant data to the brand svgs.the attributes that are deleted are sodipodi:docname inkscape:version xmlns:svg xmlns:sodipodi xmlns:rdf xmlns:dc xmlns:cc xmlns:inkscape also the groups are removed and the fill attribute is moved to the root element when the group had a fill attribute
331137910,26696,https://api.github.com/repos/twbs/bootstrap/issues/26696,emilmuller,0,0,0,0,1,0,add variable for cursor on buttons im not sure about the justification for having the pointer cursor on buttons but it doesnt sit quite right for me and id love to have the option to change it without hacking it the comments even say its opinionated
330889736,26691,https://api.github.com/repos/twbs/bootstrap/issues/26691,vchebotarev,3,0,0,0,0,0,hi.yes i know about but i have more flexible variant of this feature switch_ios can be configured via scss both android or ios styleit is almost fully based on custom-control-indicator varsit has full support of focus active and disabled statesactive state behavior is simular with ioss with increasing thumb widthall position calculations are scss flexibleim not sure about some moments are made corretly in bootstrap stylebranch was created from v tagcommit contains only scss if this realisation will be accepted ill try to add everything requiredsorry for my englishand this is my first frontend pr sorry if something is terrible wrong
