issueId,issue_number,url,user,like,dislike,laugh,hooray,confused,heart,body
185775769,21032,https://api.github.com/repos/twbs/bootstrap/issues/21032,mdo,1,0,0,0,0,0,fixes redoes some of the flexbox code there to ensure the contents of addons and buttons in input groups are sized appropriately to the form controls.see it in action at kyleneedham
185755335,21029,https://api.github.com/repos/twbs/bootstrap/issues/21029,saturdaywalkers,1,0,0,0,0,0,script defer src=jquery.js>
185628144,21026,https://api.github.com/repos/twbs/bootstrap/issues/21026,alainalexa,6,0,0,0,0,0,it appears like ul listing is dropped out from dropdown items see bootstrap alpha version).ul listing would be a great feature to have especially when the dropdown needs to be extended and to have sub-dropdowns.here attached are a screenshot of a navbar with dropdown and sub-dropdowns html code with additional css bootstrap-nabvar-menu.txt bootstrap-navbar
185570061,21021,https://api.github.com/repos/twbs/bootstrap/issues/21021,mdo,2,0,0,0,0,0,in we renamed the open to active for consistent js class names that messes with the dropdown states though for navs and button groups going to have to change that class name or find a new one to replace everything from cc johann-s starsam
185552371,21020,https://api.github.com/repos/twbs/bootstrap/issues/21020,mdo,3,0,0,0,0,0,fixes this renames the tag component to badge to avoid conflicts with some core wordpress styling its a bit of a flip flop but thats okay its an easy fix on our end to resolve this larger issue with a huge community ive updated the file names docs pages examples mixins sass variables and more should be good to go
185324637,21013,https://api.github.com/repos/twbs/bootstrap/issues/21013,mengmeng880610,0,0,0,1,0,0,study git
185293640,21011,https://api.github.com/repos/twbs/bootstrap/issues/21011,niftylettuce,1,0,0,0,0,0,width alt=screen shot at am src a for classes that set a margin or padding on all sides of the element is deprecatedas it is now p instead of pa and m instead of m-a
185183134,21010,https://api.github.com/repos/twbs/bootstrap/issues/21010,121052,1,0,0,0,0,0,in chrome i get a bug when adding input group under a card-deck the spacing between buttons and input are off the reason seem to be the border-spacing rem under card-deck.changing the border-collapse separate to border-collapse collapse under input-group seems to fix the problem however it also affects the spacing between each card
185124321,21005,https://api.github.com/repos/twbs/bootstrap/issues/21005,bardiharborow,0,0,0,0,0,2,in lieu of an official style guide this takes the eslint:recommended preset and then enables every eslint rule that does not cause significant disruption to the codebase it then disables the rules needed for js/tests to pass as that follows a slightly different style we may wish to tighten quite a bit of this later but its better than what we currently have.this is one half of the fix for the other half being houndci/hound this works towards but i suspect there is more to do noting especially that eslint does not cover all folders yet as per
185093677,21002,https://api.github.com/repos/twbs/bootstrap/issues/21002,Lausselloic,1,0,0,0,0,0,the fix table-hover table-stripped combined with table-inverse works but for accessibility reason could we have a dedicated background value for those states?for example actual value for table table-bg-accent table-bg-hover table-bg-active can be completed with table-inverse-bg-accent table-inverse-bg-hover table-inverse-bg-active
184615043,20974,https://api.github.com/repos/twbs/bootstrap/issues/20974,kinganu,2,0,0,0,0,0,"hi,i apologize if this has been asked before but im having trouble finding a simple solution to have an image sequence crossfading transition like carousel with an image fading effect rather than slide a slow opacity fade into new image second animation time with seconds interval between images tried tons of examples bootply custom ones ppl made none work for me i want a smooth slow crossfade thats enjoyable to watch its odd that bootstrap i use has such an easy copy/paste carousel slide with no css needed yet something comparable like an image fade carousel doesnt exist without convoluted css and js and jquery media queries and tons of configs which do not work because of absolute positioning tricks etc wish this feature could be added examples of what im looking for are here tried them all doesnt work with my standard carousel:demo"
184455238,20970,https://api.github.com/repos/twbs/bootstrap/issues/20970,jvanderkroon,1,0,0,0,0,0,diplay:inline-block on the figure creates a bug in ie and firefox lt the image doesnt listen to the max-width and gets bigger than the available space.see the demo
184328926,20965,https://api.github.com/repos/twbs/bootstrap/issues/20965,alanmoo,1,0,0,0,0,0,the documentation indicates that classes such as pa will apply padding to all sides but thats since been changed to be just p- .im not quote sure what youd like it to say or id open a pr everything i come up with is really wordy. relevant code
184306388,20964,https://api.github.com/repos/twbs/bootstrap/issues/20964,pvdlg,1,0,0,0,0,0,following change introduced in box-shadow for an input should be set if enable-shadows is true and enable-rounded
184294026,20963,https://api.github.com/repos/twbs/bootstrap/issues/20963,alanmoo,2,0,0,0,0,0,creates classes like col-xs-auto col-sm-auto etc.these allow a column to automatically be sized based on its content at certain viewports using the same cascade of the rest of the column sizing classes theyre useful for elements that you might want stacked on smaller screens but normally lay out nicely on a horizontal at larger screens without the need to be fixed to a specific grid at those sizes
184293390,20962,https://api.github.com/repos/twbs/bootstrap/issues/20962,patrickhlauke,1,0,0,0,0,0,uses a custom string replacement function to ensure that characters are correctly url encoded to to avoid firefox/ie choking on the svg data urls.closes
184173469,20956,https://api.github.com/repos/twbs/bootstrap/issues/20956,fdaunis,2,0,0,0,0,0,"up-down arrows on custom select control no visible on firefox and ie on chrome works fine.on bootstrap alpha works ok on alpha you have a error on css.! chome alpha:data:image/svg+xml;charset=utf,%csvg xmlns viewbox e%cpath fill d=m l hzm l hz/%e%c/svg%ebootstrap_..-alpha.css line error alpha:data:image/svg+xml;charset=utf,%csvg xmlns viewbox e%cpath fill d=m l hzm l hz/%e%c/svg%ebootstrap_..-alpha.css line"
184164321,20955,https://api.github.com/repos/twbs/bootstrap/issues/20955,zomp,1,0,0,0,0,0,could you reopen issue modals overlapped by tooltips/popovers and close this one please unfortunately i have no rights to do so
184069389,20952,https://api.github.com/repos/twbs/bootstrap/issues/20952,fvsch,3,0,0,0,0,0,hi currently the gray-light s contrast ratio on top of a white background doesnt meet the wcag minimum for body copy current value is scss$gray-light a default; the contrast ratio for a on ffffff is tested with and wcag aa calls for a minimum contrast of for body copy.it seems that this color is used to signify muted text disabled elementsfor muted text a darker value such as gray might be better?for disabled elements maybe shooting for the highest accessible value would be alright in my tests both and f are just at or above on a ffffff background).or going for a more generic solution maybe just lowering gray-light in the range e.g a keeping the slightly blue hue
184055114,20950,https://api.github.com/repos/twbs/bootstrap/issues/20950,ova2,1,0,0,0,0,0,for a regular grid we have this file the result css only contains grid speicific styles we need the same for a flexbox based grid there are many users that only want to use the flexbox based grid in there projects with angular or react components
183988135,20946,https://api.github.com/repos/twbs/bootstrap/issues/20946,chuoke,0,0,0,0,4,0,"i like bootstrap,and i hope it be more powerful.markdown is popular and fashion more and more there are many applications use markdown,especially the world of developer and writer.can bootstrap support or parse markdown"
183886139,20937,https://api.github.com/repos/twbs/bootstrap/issues/20937,mdo,5,0,0,0,0,0,alpha is seeing a major navbar update but its still not ready for prime time im struggling to figure out a solid way to build this right now that works for all the components responsive behaviors and the default/flex variations.with some of the other alpha changes i have planned im hoping to get these remaining navbar issues in our next release container adding extra padding for mobile sizes revisit light/dark nomenclature revisited flexbox support added better navbar-text support migration docs added
183871083,20936,https://api.github.com/repos/twbs/bootstrap/issues/20936,bkdotcom,3,0,0,0,0,0,default stacked and without label markup html
183857040,20934,https://api.github.com/repos/twbs/bootstrap/issues/20934,mdo,25,3,0,0,0,0,this explores adding responsive display utilities replacing the static inline inline-block and block options we have currently the twist here though is that the lowest breakpoint doesnt have a breakpoint abbreviation in the class name. heres an example of what i mean with just the display none utility css same as d-xs-none but without the xs part d-none display none important media min-width px d-sm-none display none important media min-width px d-md-none display none important media min-width px d-lg-none display none important media min-width px d-xl-none display none important im exploring this since the lack of xs could make it an easier transition to v for those who used the v utilities plus its a bit more accurate to whats happening in the compiled css since theres no media query around those styles.thoughts
183803967,20931,https://api.github.com/repos/twbs/bootstrap/issues/20931,KKSzymanowski,1,0,0,0,0,0,currently alert padding is defined as px and card-header padding as rem rem .because of this the text isnt aligned vertically:! przechwytywanie dont know if this is intentional or not but for me it doesnt look that good. here is a live example with two possible fixes.is this something i should configure on my end or should i make a pull request to include it in the core
183682274,20928,https://api.github.com/repos/twbs/bootstrap/issues/20928,dritir,1,0,0,0,0,0,i am working with rails gem bootstrap alpha after updating to gem bootstrap alpha card-columns became unstable.a static page would break a card in the middle img from text like in the pen below and start do blink between the correct card position versus this broken one.im using chrome lastest build.bs-alpha pen pen
183582864,20926,https://api.github.com/repos/twbs/bootstrap/issues/20926,mdo,4,0,0,0,0,1,this makes the spacer utilities responsive instead of mt for example we have mt-sm bit longer of a class name but more versatile
183245425,20907,https://api.github.com/repos/twbs/bootstrap/issues/20907,matheusazzi,2,0,0,0,0,0,fixes bugs all keydowns were being prevented because of that the user wasnt able to navigate in the whole page using arrow_up/arrow_down even when is an input or textarea the keydowns were being prevented because of that the user wasnt able to type any text on these elements
183245164,20906,https://api.github.com/repos/twbs/bootstrap/issues/20906,rocifier,1,0,0,0,0,0,my cards when used inside of card-columns only fill two of the three columns unless i change the card class to have position static unfortunately this is a full website so i dont have a simple example right now.recommended set default card position attribute to static
182866847,20898,https://api.github.com/repos/twbs/bootstrap/issues/20898,roooodcastro,1,0,0,0,0,0,the modal documentation page for v was using btn-default in the using the grid system example.i changed it to the new correct class of btn-secondary
182451275,20884,https://api.github.com/repos/twbs/bootstrap/issues/20884,cvrebert,6,0,0,0,1,0,x better than our homegrown npm-shrinkwrap-based scheme
181912778,20866,https://api.github.com/repos/twbs/bootstrap/issues/20866,mdo,2,0,0,0,0,2,for example v-align-middle and what not
181911105,20865,https://api.github.com/repos/twbs/bootstrap/issues/20865,mdo,0,0,0,1,0,0,grouping a handful of css and docs changes related to the grid moves from max-width containers to width with a max-width this corrects inconsistencies between browsers and default/flexbox grid implementations previously some containers wouldnt occupy their full max-width fixes changes the values of the sm breakpoint and container now the breakpoint is wider than the container this was a longstanding bug from me sorry about that grin fixes changes the large grid breakpoints value from px to px so that every grid tier in its max width is cleanly divisible by fixes update grid docs to match all the above changes
181770026,20859,https://api.github.com/repos/twbs/bootstrap/issues/20859,bradly,1,0,0,0,0,0,in v there are two variables that are named similar and act similar but are different font-size-sm and small-font-size scss$small-font-size default scss$font-size-sm rem default; this was causing some confusion on my team when someone removed font-size font-size-sm from an elements css in favor of a small class in the html so couple questions is this a bug or as designed if it is as designed is there a desire to change something to make it less confusing one change that would allow small to continue to change things relevant to its parent but keep text the same as font-size-sm when the parent has a normal height would be to change small-font-size to not sure though.anyways thanks again for all the work on bs weve been using it in prod since jan and really appreciate all the effort thats gone into making it great
181142383,20841,https://api.github.com/repos/twbs/bootstrap/issues/20841,QuantumHive,2,0,0,0,0,0,im using the bootstrap collapse accordion example ive noticed that when using the javascript collapse methods the accordion effect seems to be acting unexpected.see this simple jsfiddle example im using collapseone).collapse(toggle why because to demonstrate the following behavior initially because of this piece of javascript panel gets expanded clicking on panel gives us the accordion effect as one would expect clicking back on panel gives an unexpected behavior in that both panels now are expanded.now if you remove the javascript and execute the following steps click on panel to expand click on panel to get the accordion effect clicking on panel again still gives us the accordion effect_.the observation here is that when using the collapse(toggle method the accordion effect seems to be broken?would one expect this to break or might this be a bug
180635102,20830,https://api.github.com/repos/twbs/bootstrap/issues/20830,christian-fries,9,0,0,0,0,0,often you want an image to fill the whole width of the containing element img-fluid can be used to fill the containing element and scale down but theres no option for scaling up if the containing element is bigger than the actual image size even if its only some pixels in some special viewports the image wont fill the whole element this is bad for the design in most cases worse than upscaling an image for some pixels.for this case we created a class img-fill which sets display block width height auto the frontend developer then can decide if he wants images to scale up and down by using img-fill or if he only wants them to scale down by using img-fluid i propose this as an official feature of bootstrap
180534620,20824,https://api.github.com/repos/twbs/bootstrap/issues/20824,eddywashere,6,0,0,0,0,0,i believe there is an issue with opening modals that causes fixed content to be shifted.heres an example on osx chrome and have system preferences general show scroll bars always .i believe this is sort of tracked in the modal section of v issue but does not contain an active issue to track it finally fix that shifting content bug by updating the modal.js to not adjust body padding but rather the padding on a specific set of classes.i found an issue that was closed because it was part of v
180447822,20819,https://api.github.com/repos/twbs/bootstrap/issues/20819,mvdriel,1,0,0,0,0,0,i think there are two issues with the current implementation of the progress bar the global brand-primary color doesnt effect the color of the default progress bar its color is still the default blue the naming of the color variables for the progress bar is confusing because their names end on bg for example progress-bar-success-bg although they change the foreground color of the progress bar
180277709,20813,https://api.github.com/repos/twbs/bootstrap/issues/20813,niftylettuce,24,0,0,1,0,7,i thought i should share this maybe we could make this into a javascript component that can be toggled its a super helpful little javascript snippet and css that lets you have custom file input boxes with the choose file and browse buttons but when the user changes the file input selects a file it will show the file name it should be cross-browser compatible as well i used lodash for the but it could be refactored with whatever cvrebert and mdo would use here i just did this pretty quickly hope you dont mind the es syntax example screenshots before input is selected:! screencapture-localhost--jobs-create after input is selected:! screencapture-localhost--jobs-create usage javascript js handle custom file inputs body).on(change input type=file data-toggle=custom-file function ev const input this const target input.data(target const target target if target.length return console.error(invalid target for custom file input if target.attr(data-content return console.error(invalid data-content for custom file target input set original content so we can revert if user deselects file if target.attr(data-original-content target.attr(data-original-content target.attr(data-content const input input.get let name isobject(input isobject(input.files isobject(input.files isstring(input.files .name input.files .name input.val if isnull(name name name target.attr(data-original-content target.attr(data-content name html html label class=custom-file d-block input data-toggle=custom-file data-target=#company-logo type=file name=company_logo accept=image/png class=custom-file-input span id=company-logo class=custom-file-control custom-file-name data-content=upload company logo...>
179939831,20811,https://api.github.com/repos/twbs/bootstrap/issues/20811,spikeon,2,0,0,0,0,0,so i came across an issue with how the collapsable nav works in the documentation and wanted to tell you how i changed it to work the way i wanted it to work i put assigned pull-left to the collapse button i moved the navbar-brand outside the collapse before it i added media max-width px navbar-toggleable-xs clear:both this shows the brand while the menu is closed and then displays the items under it when its open without the clear:both the first navigation item was appearing to the right of the brand.i hope this helps you guys im loving the alpha so far keep up the great work
179905320,20809,https://api.github.com/repos/twbs/bootstrap/issues/20809,natcohen,0,0,0,0,1,0,if you create a select and an input next to each other you will see that the select is bigger than the input they should have the same height
179744167,20804,https://api.github.com/repos/twbs/bootstrap/issues/20804,semmais,1,1,0,1,0,0,instead using a empty div in markup like optional clear the xs cols if their content doesnt match in height div class=clearfix hidden-sm-up> i suggest something like: with some implementation like $max-clear-cols each breakpoint in map-keys($grid-breakpoints include media-breakpoint-up($breakpoint for i from through max-clear-cols clear-#{$breakpoint}-#{$i nth-child(n clear:none clear-#{$breakpoint}-#{$i nth-child(#{$i}n+#{$i clear:both
179527451,20798,https://api.github.com/repos/twbs/bootstrap/issues/20798,shellysaju,2,0,0,0,0,0,currently its showing in different height example:! bugb adding css we can adjust it but it will be nice to add a bootsrap class and maintain the grid columns height equal and also maintaining button in same vertical line it will be good.! bugg_bootstrap you make the adjustment and update in coming version.thanks and regardsshelly
179440418,20794,https://api.github.com/repos/twbs/bootstrap/issues/20794,m5seppal,78,0,0,0,0,0,i think its very common use case that you want to have card content vertically in small screen and in bigger screens content is aligned horizontally for example implemented this for my own project roughly so that: .card display flex flex-direction column;}.card-img order card-block order card-img-last order card-img-last is basically same than card-img-bottom but it doesnt care about order in source and also naming works better with horizontal cards where last refers to the right side.then i have horizontal classes for cards which needs to be added in addition to basic card class: .card-horizontal flex-direction row;}.card-horizontal-sm-up card-horizontal-md-up etc..card-horizontal card-img flex card-img-width;}.card-horizontal card-block flex calc card-img-width)} something like that not a perfect example but gives the basic idea how it is working im using card-block now as a flex item but it wont work if i want to have card header or footer there should be some wrapper div which contains all content expect image.only problem with this is to make image behave well in horizontal view in my implementation card-img is just a div container then img is inside that and i use object-fit ie/edge fix with javascript to cover the whole div ive set minimum and maximum height for card-block to have always reasonably sized image there.i would like to hear if this is wanted feature and then opinions what would be the correct implementation obviously we need to have also non-flex-box solution for that
179396960,20792,https://api.github.com/repos/twbs/bootstrap/issues/20792,MrCsabaToth,1,0,0,0,0,1,afaik its not included
178584768,20766,https://api.github.com/repos/twbs/bootstrap/issues/20766,iTsFILIPOficial,6,0,0,0,0,0,it seems that there is alot of people wanting to have their navbars centered on the page may be good to include a css class such as navbar-center that will center all the element in the navbar. text-center on the navbar div doesnt work as it meant to only center text and not all elements.reference
178368625,20758,https://api.github.com/repos/twbs/bootstrap/issues/20758,josheby,1,0,0,0,0,0,on chrome on android when clicking the dropdown button on the split button the spacing shifts on the right side and extra padding or margin is added see screenshots i didnt see any other issue that appreaed related so i am opening a new issue let me know if i can provide any further information.! screenshot version:chome operation system:android nexus build mobe
178106142,20752,https://api.github.com/repos/twbs/bootstrap/issues/20752,mihaistoie,1,0,0,0,0,0,inline forms labels of input groups are placed above input fields inlineforms htmlamount label div class=input-group div class=input-group-addon>$amount label input type=text class=form-control id=exampleinputamount placeholder=amount div div>
177645140,20741,https://api.github.com/repos/twbs/bootstrap/issues/20741,sbaechler,5,0,0,0,0,0,right now bootstrap uses the hardcoded font weights bold and normal .websites might use different weights such as medium or thin or use light as default weight instead of normal .if bootstrap used settings variables for font-weight-normal and font-weight-bold the user could easily override the default values or use numerical weights.this would also help those two lines could be added to the variables.scss: $font-weight-normal normal;$font-weight-bold bold; all occurrences of font-weight normal would be replaced by font-weight font-weight-normal the same applied for font-weight bold; .foundation uses a similar approach could create a pull-request for this
177644768,20740,https://api.github.com/repos/twbs/bootstrap/issues/20740,zdroid,1,0,0,0,0,0,eslint has basically replaced jscs completelly almost all rules are supported and missing ones are in process of addition eslint/eslint it may need some reviewing the used jscs rules but i think bootstrap can stop using jscs in v.thoughts
177509080,20734,https://api.github.com/repos/twbs/bootstrap/issues/20734,beausmith,8,0,0,0,0,0,fixes pr another solution to this issue hard-codes use of body-color which may not be the desired color for the text when hovering before! before after! after color-brand-teal
177074469,20721,https://api.github.com/repos/twbs/bootstrap/issues/20721,mdo,3,0,0,0,0,0,hey everyone!we just launched projects on github code review new profiles integrations graphql api and more dand id love to know how the bootstrap community would like us to use the feature here we havent been the best at communicating larger changes or what were actively focused on and id love to give folks better information so they can contribute more easily what kind of columns would you like to see whats missing from our current milestones setup do our ship lists work well enough for yall any new labels we should look into e.g has-pull-request )?holler with any and all feedback i started putting together one for our next v release alpha but wanted to pause that until more folks had the opportunity to help direct its usage
176764268,20715,https://api.github.com/repos/twbs/bootstrap/issues/20715,VarelloThemes,4,0,0,0,0,3,bearing in mind the budding younger programmers
176504974,20709,https://api.github.com/repos/twbs/bootstrap/issues/20709,mdcuesta,6,0,0,0,0,0,i got an error uncaught referenceerror util is not defined when referencing plugins individually jquery defined global import util.js; import modal.js the rest is html.note that referencing the bootstrap.js directly works jquery defined global import bootstrap.js
