issueId,issue_number,url,user,like,dislike,laugh,hooray,confused,heart,body
261599411,24168,https://api.github.com/repos/twbs/bootstrap/issues/24168,Dygear,1,0,0,0,0,0,adds viewport-fit=cover to the meta viewport tag allowing for page headers and footers to span the entire screen with the iphone x
261401079,24164,https://api.github.com/repos/twbs/bootstrap/issues/24164,andresgalante,1,0,0,0,0,0,even though this pr doesnt solve its related to it.pagination doesnt wrap so when the user has lots of pages it generates a horizontal scroll bar:! screen shot at pm pr introduces a wrap its not a perfect solution for responsive paginations but at least it doesnt break the layout:! screen shot at pm do you think
261398794,24163,https://api.github.com/repos/twbs/bootstrap/issues/24163,andresgalante,1,0,0,0,0,0,to keep things dry this pr is using the list reset on pagination.what do you think
261327103,24159,https://api.github.com/repos/twbs/bootstrap/issues/24159,wilkmit,5,0,0,0,0,0,i came across this pagination solution and thought it would work perfectly with bootstrap responsive design when pagination falls to a second or third row i find it to be a waste of space and it also looks ugly anyway this is the most elegant solution i have seen so far.! pagination
261308628,24158,https://api.github.com/repos/twbs/bootstrap/issues/24158,Johann-S,1,0,0,0,0,0,things to do x make sure we return proper error levels x change sauce_browsers.yml to json file x use this json with jsunitsaucelabs x remove grunt and other grunt dependencies~work in progress...~fixes cc xhmikosr
261307175,24157,https://api.github.com/repos/twbs/bootstrap/issues/24157,intellix,3,0,0,0,0,0,ive been using bootstrap since throughout and have already delivered some using what started out as server-generated html with jquery became whole applications using libraries like angular and react.herein lies my problem with the direction that bs took and where is also going now that its easier to create re-usable components and even manage layouts responsively using js i find myself fighting the mobile-first/responsive functionality and state-management thats forced upon me via bs.some examples of pain points navigations now require you to use a helper class to automatically collapse navbar-expand cards automatically wrap around as the screen gets smaller form styling depends on a specific ordering of dom due to sibling selectors like scss.invalid-feedback display none;}.form-control is-invalid invalid-feedback display block the above makes it difficult to componentise things without having an exact structure of dom htmlrequired bs had direct-child selectors for things like navigations which made it difficult for angular because you had to do a lot of wrapping for conditionally displaying dom now bs is enforcing siblings for state-management.a couple of years ago all of this was excellent because state management and responsive sites required a lot of work and were difficult when the server-generated your dom nowadays id just be happy with having a css framework that looked great out of the box but allowed me to manage state/responsiveness myself.what id like to see responsive/mobile-first split away at least different scss files so i can choose to not include them state management split away things like display none and sibling-selection to display things)would you accept prs for stuff like this or does it go against where youd like bootstrap to be in the fe space
261297719,24156,https://api.github.com/repos/twbs/bootstrap/issues/24156,tbolon,1,0,0,0,0,0,as explained quite clearly on this article hand pointer cursor should be limited to links on text and images.the rule seems to be for a button there is no need to use a pointer cursor for a text link a pointer cursor should be used.currently the underlying element is not altered if you render a classic link as a button a with class=btn the cursor is still a hand cursor.for example in the documentation for the first button for this button only the cursor is a pointer.also note that the same is true for button elements rendered as links button with class=btn-link the link should be rendered with a hand cursor see this example on the doc nave implementation could be: .btn-link cursor pointer a.btn cursor default if the solution is as simple as this i can submit a pr.regards
261288098,24155,https://api.github.com/repos/twbs/bootstrap/issues/24155,heikojansen,1,0,0,0,0,0,especially when using dropdowns in a navbar as a site navigation element i would like to show the dropdown menu on mouseenter events without requiring the users to click on the split toggle.i think this could be an optional feature and would require only a small amount of extra code cf my minimal test implementation at does require scripted initialization the data api as currently implemented wouldnt suffice and a special config flag but i would consider that a feature...you can test it here that i also need a small css modification to close a gap between the parent nav-item and the dropdown which would trigger mouseleave events.)i wonder if you would be willing to add this as an official feature to bootstrap?if yes id try to put together a proper pull request on the js source file.if not i am interested in the reasons e.g if you think that this has accessibility issues
260972785,24145,https://api.github.com/repos/twbs/bootstrap/issues/24145,XhmikosR,0,0,0,0,0,1,fixes so the sizes bundlesize reports are the gzip ones i went with pretty strict values and separate entries but we can always change them if needed.now in order for the github integration to work mdo needs to take care of
260716072,24126,https://api.github.com/repos/twbs/bootstrap/issues/24126,mdo,1,0,0,0,0,0,fixes this goes in reboot vs the btn class given it affects button elements everywhere e.g dropdown items this shouldnt affect the display much given we neutralize a bunch of other styles on the button element already./cc razh
260695210,24125,https://api.github.com/repos/twbs/bootstrap/issues/24125,jorismulliez,1,0,0,0,0,0,"hi,im trying to print a big bordered table.so there is several pages to print.on chrom(ium all is find.but on firefox borders are printed only on the first page.here is my browser versions and a jsbin for test case system and version linux mint cinnamon bit browser and version firefox bits test for your help"
260635739,24121,https://api.github.com/repos/twbs/bootstrap/issues/24121,XhmikosR,1,0,0,0,0,0,ok so currently i find it quite annoying that i need to open separate cmds to do local development one with bundle exec jekyll watch and another one with npm run watch most importantly i feel like our scripts dont include important parts.when i do npm run css it makes sense to me to run the docs-css script too and so on.opening the issue to track it and to find solutions to improve this./cc johann-s bardiharborow
260582036,24111,https://api.github.com/repos/twbs/bootstrap/issues/24111,marcoscv-work,1,0,0,0,0,0,i think bootstrap should offer a behavior aligned with common responsive problems by default so btn-groups should wrap buttons and use flex-nowrap in btn-group when you need this specific infinite in-line behavior.besides it would be more consistency with the previous version:! image
260573624,24109,https://api.github.com/repos/twbs/bootstrap/issues/24109,XhmikosR,1,0,0,0,0,0,use a trailing slash when possible use https when possible remove a few redirected links consistently use fix iconurl in nuget filesrefs
260515715,24099,https://api.github.com/repos/twbs/bootstrap/issues/24099,Johann-S,2,0,0,0,0,0,work in progress
260403862,24092,https://api.github.com/repos/twbs/bootstrap/issues/24092,Johann-S,1,0,0,0,0,0,add display option to our dropdown which will allow folks to use popper.js if display is equal to dynamic default value or to not use popper.js with display equal to static close xhmikosr mdo
260376615,24090,https://api.github.com/repos/twbs/bootstrap/issues/24090,mwentz,3,0,0,0,0,0,the mixin for button-variant is defined like this: @mixin button-variant($background border active-background darken($background active-border darken($border because of this if you want to have the active background darker or lighter for example you either have to change the mixin file or write more custom css this could be easily fixed:/mixins/_buttons.scss @mixin button-variant($background border active-background active-border) _variables.scss $active-background darken($background active-border darken($border it looks as though this was probably the original intent but somebody forgot to move those variables out of the mixin file
260358715,24089,https://api.github.com/repos/twbs/bootstrap/issues/24089,mayank-mittal,0,2,0,0,0,0,im having a problem with this
260358647,24088,https://api.github.com/repos/twbs/bootstrap/issues/24088,mayank-mittal,0,1,0,0,0,0,im having a problem with this
260358630,24087,https://api.github.com/repos/twbs/bootstrap/issues/24087,mayank-mittal,0,2,0,0,0,0,im having a problem with this
260358595,24086,https://api.github.com/repos/twbs/bootstrap/issues/24086,mayank-mittal,0,1,0,0,0,0,im having a problem with this
260100705,24076,https://api.github.com/repos/twbs/bootstrap/issues/24076,Chealer,0,0,0,0,1,0,the documentations first section on the grid system asks sounds good?.as pointed out in issue sounds not so good so assuming a positive answer with great lets move on to seeing all that in an example is pretentious at this time in any case it would be preferable to avoid unnecessarily questioning the reader since the paragraph is not immediately followed by examples i would suggest to just remove it or to fix and move down
260099616,24074,https://api.github.com/repos/twbs/bootstrap/issues/24074,schwastek,1,0,0,0,0,0,concerns function theme-color-level in functions.scss file.use internal sass function abs to get the absolute value of level argument.that way if/else statement can be completely eliminated screenshotboth old and new functions return the same values.! new theme-color-level function values testcheck out this pull request locally or reproduce it from scratch run: bashgit clone bootstrap remove all files but scss and git foldersfind not path git o path scss prune exec rm rf touch scss/_debug.scssprintf import functions;\n@import variables;\n@import debug scss/bootstrap.scssnpm init yesnpm install nodemon node-sass save-dev overwrite scripts section in package.json with: jsonscripts css-compile node-sass scss/bootstrap.scss dist/css watch-css nodemon ext scss watch scss exec npm run css-compile add at the end of functions.scss scss functions.scss(...)@function new-theme-color-level($color-name primary level color theme-color($color-name color-base if($level fff level abs($level return mix($color-base color level theme-color-interval paste into debug.scss : scss@debug theme-color-level(primary debug theme-color-level(primary debug theme-color-level(primary debug new-theme-color-level(primary debug new-theme-color-level(primary debug new-theme-color-level(primary run: bashnpm run css-compile
259997631,24061,https://api.github.com/repos/twbs/bootstrap/issues/24061,romanlex,1,0,0,0,0,0,hello i have warning when trying compile styles with this variables: $container-max-widths sm px md px lg px xl include assert-ascending($container-max-widths container-max-widths); message: warning potentially invalid value for container-max-widths this map must be in ascending order but key xl has value whose unit makes it incomparable to px the value of the previous key lg i think what this block is wrong and should ignore the specified values in percentage @each key num in map if prev-num null do nothing else if not comparable($prev-num num warn potentially invalid value for map-name this map must be in ascending order but key key has value num whose unit makes it incomparable to prev-num the value of the previous key prev-key else if prev-num num warn invalid value for map-name this map must be in ascending order but key key has value num which isnt greater than prev-num the value of the previous key prev-key prev-key key prev-num num
259900587,24056,https://api.github.com/repos/twbs/bootstrap/issues/24056,tillmon,2,0,0,2,0,0,if all font-sizes are relative to font-size-base it would be simpler to change overall font-size: css$font-size-base rem default;$font-size-lg font-size-base default;$font-size-sm font-size-base default
259820572,24052,https://api.github.com/repos/twbs/bootstrap/issues/24052,andresgalante,2,0,0,0,0,0,this pr is s simple fix turns this:! screen shot at am this:! screen shot at am
259801328,24050,https://api.github.com/repos/twbs/bootstrap/issues/24050,iamandrewluca,4,0,0,0,0,0,check form-control-focus mixin variable name is input-focus-border-color
259494964,24033,https://api.github.com/repos/twbs/bootstrap/issues/24033,Bobeta,2,0,0,0,0,0,current docs on the subject can easily be interpreted as the user should import their modified variables after importing bootstrap sass files this pr aims to make it clearer
259281523,24018,https://api.github.com/repos/twbs/bootstrap/issues/24018,michaelkrieger,1,0,0,0,0,0,mw was added in however like many of the others this should have other breakpoints and maybe as well).this would be in bootstrap/scss/utilities/_sizing.scss_example use where i have a jumbotron where i wish for it to wrap at and thus only be on the left side of the screen showing the bootstrap-stack.png background image on the right side imagine this with an image that is a light background on the left side and photography on the right. headingwe can really help you...call me
259156210,24015,https://api.github.com/repos/twbs/bootstrap/issues/24015,andresgalante,2,0,2,0,0,1,this pr closes and it adds breakpoints to sizing utility classes.it also updates the docs to surface this change.@johann-s you know my feelings about utility classes but i think that since we are doing this for spacers adding it for sizing is valid.closes too
258921419,24003,https://api.github.com/repos/twbs/bootstrap/issues/24003,matthewaptaylor,2,0,0,0,0,0,will it be possible to add responsive classes to the w class?for example only w w w w and w currently exist can classes such as w-sm or s-xl be added
258635644,23994,https://api.github.com/repos/twbs/bootstrap/issues/23994,madmax,3,0,0,0,0,0,when we choice file nothing change we dont see filename should work this way we need write js to look change event and update filename inside custom-file-control tested on beta safari and chrome macos
258627405,23992,https://api.github.com/repos/twbs/bootstrap/issues/23992,michaelkrieger,2,0,0,0,0,0,having a variety of issues with printing and created a test case to help explain it with some pdf samples using the v beta as can be seen in my print-demo.txt rename to html and you can view this in any browser designed to be a test case which spans a number of pages for ease of debugging. print-demo.txt of these can be fixed with uncommenting the media print stylesheet in the heading but this causes other display problems of course with various browsers. firefox v mostly blank page three full flex boxes three cut off and missing headers print-demo firefox.pdf v printing from full width correctly displays the six flex boxes stops after the first of the cards does not display two of the boxes does not display the footer at all print-demo chrome.pdf v printing from a narrow width by resizing the browser very narrow and then printing the page seems to do everything correctly print-demo chrome narrow).pdf
258610619,23990,https://api.github.com/repos/twbs/bootstrap/issues/23990,arizzitano,4,0,0,0,0,0,the dropdown styles explicitly remove the browsers default focus outline for links within the menu which hurts accessibility as it violates wcag aa section edit technically the focus highlight background color prevents it from failing without the focus outline keyboard-only users cannot orient themselves within a dropdown menu which can be especially troublesome if the implementor has also applied a focus trap.this pr removes the override enabling the browser to apply its own native focus outline to links within the dropdown menu the outline will only appear if a link has focus so mouse users will see virtually no change .suggestions welcome happy to amend as necessary screenshotsbefore after|------|------|! image image
258549859,23987,https://api.github.com/repos/twbs/bootstrap/issues/23987,michaelkrieger,4,0,0,0,0,0,currently you can have a card with an image on top or bottom but not to the left as is typical).requesting that card-img-left and card-img-right be added getting your very typical box with some text and an image to the left or right on desktops and as a top-cap on mobile.example desired behaviour img title img text text text text img button example code using columns instead of cards of what i want to do div class=container div class=row align-items-center div class=col col-md->titlecopycontact us possible solutions in bs solutions explored media left this looks great at full width however as the viewport shrinks the image stays the same size and the text stays on the right shifting further right if done in a card this would stack when the width gets too small. titlecopycontact us float left doesnt seem to work for this image
258389806,23984,https://api.github.com/repos/twbs/bootstrap/issues/23984,kaansengul,4,0,0,0,0,0,im currently using bootstrap beta and i have nested tabs when try to switch between them it confuses.im not sure it had the same behaviour in bootstrap alphas but i think it is a new behaviour in the beta.html jsfiddle class=card div class=card-header ul class=nav nav-tabs card-header-tabs id=outertab role=tablist li class=nav-item a class=nav-link active data-toggle=tab href=#tabc aria-controls=tabc role=tab aria-expanded=true>tab-tab-tab-nested tab-nested tab-nested tab-
258371183,23982,https://api.github.com/repos/twbs/bootstrap/issues/23982,Jakobud,1,0,0,0,0,0,currently font-size-base is defined as: $font-size-base rem default; if you attempt to define your base font size using pixels for example: $font-size-base px; then sass will not compile because of incompatible units rem and px in various calculations it seems like you should be able to define a font size using pixels if you are working with a designer who is using sketch or something you can sure bet that they have their fonts defined in pixels a designer is not going to have any clue what a rem is
258267798,23970,https://api.github.com/repos/twbs/bootstrap/issues/23970,andresgalante,1,0,0,0,0,0,there is a definition of font-weight-light on text utility classes here its not surfaced on the docs this pr is adding it
258062814,23959,https://api.github.com/repos/twbs/bootstrap/issues/23959,XhmikosR,1,0,0,0,0,0,just picked up some of the fixes i found from my stylelint pr
257752462,23951,https://api.github.com/repos/twbs/bootstrap/issues/23951,Herst,1,0,0,0,0,0,some bs remains found using my bootlint adaption for bootstrap twbs/bootlint
257749232,23949,https://api.github.com/repos/twbs/bootstrap/issues/23949,Herst,1,0,0,0,0,0,found with my bootlint fork twbs/bootlint
257679548,23948,https://api.github.com/repos/twbs/bootstrap/issues/23948,Rud5G,1,0,0,0,0,0,to fix the images show in the album example in the docs
257563303,23947,https://api.github.com/repos/twbs/bootstrap/issues/23947,milgron,2,0,0,0,0,0,the first col on the biggest row got the d-sm-none class but doesnt works in fact the col appears right in sm but doesnt display in the another responsive classes im using the cdn not the files body div class=container div class=row div class=col-sm color borde header div div div class=row div class=d-sm-none col-sm col-md color borde left div div class=col-sm col-md color borde content div div class=col-sm col-md color borde right div div div class=row div class=col col-sm color borde footer div div div>
257426666,23943,https://api.github.com/repos/twbs/bootstrap/issues/23943,gijsbotje,3,0,0,0,0,0,to me it seemed weird that this is a mixin that always returns the line color xxx i modified it to be an actual function and only return a value to be used in any propertyalso updated every use of the function to use the actual function
257384592,23940,https://api.github.com/repos/twbs/bootstrap/issues/23940,NielsHolt,2,0,0,0,0,0,this pr adds eight new values for placement for popover and tooltips: topleft topright righttop rightbottom bottomleft bottomright lefttop leftbottom example! eight new popover placement demo please see this demo originalthe pr is based on bootstrap-popover-extensions and adjusted with the appriciated help from fezvrasta
257227399,23932,https://api.github.com/repos/twbs/bootstrap/issues/23932,andresgalante,2,0,0,0,0,0,it only happens on a very specific width here it pushes the search bar out play with it and youll see it.! screen shot at pm nobody wants to take this one ill probably work on it this week
257204117,23930,https://api.github.com/repos/twbs/bootstrap/issues/23930,Fouzyyyy,0,1,0,0,0,0,"this pr fixes it seems to do the trick.tested in recent versions of chrome firefox,...and ie"
257145377,23929,https://api.github.com/repos/twbs/bootstrap/issues/23929,andresgalante,1,0,0,0,0,0,fixes ie but introduces a bug on small devices on navbar on any browser you can test it on v-dev branch.this pr closes ive tested on ie up and other modern browsers.@xhmikosr mdo can you please review it
257130351,23928,https://api.github.com/repos/twbs/bootstrap/issues/23928,peter-mumford,1,0,1,0,0,0,there are a bunch of errors on the bootstrap page see screenshot.! image
256696006,23918,https://api.github.com/repos/twbs/bootstrap/issues/23918,andresgalante,3,0,0,0,0,0,this pr closes kriim makes a valid point on using and changing theme variables you cannot overwrite the variables inside the map unless you actually change the source which is something you wouldnt want to do.this pr move theme variables outside the map as suggested by kriim
256675002,23916,https://api.github.com/repos/twbs/bootstrap/issues/23916,Cronkan,3,0,0,0,0,0,having a main-container with app-container position fixed top right bottom left overflow-y auto div class=app-container div class=modal div> makes the backdrop position above the modal blocking everthing.plunker with angular where modal.html and modal.ts has code for autoopening modal and app.ts and app.scss has template for main window) edit seems like using appendto(body when opening modal is a workaround i.e examplemodal).appendto(body).modal(show
256575346,23911,https://api.github.com/repos/twbs/bootstrap/issues/23911,andresgalante,2,0,0,0,0,1,since the hover and the active state are the same then toggles are impossible to spot when the mouse is over the btn.this pr makes active state a bit darker than hover.! image of the hover vs active toggle btn fixes
256551465,23908,https://api.github.com/repos/twbs/bootstrap/issues/23908,kriim,2,0,0,0,0,0,"pull request introduced the two color maps colors and theme-colors : $colors blue blue indigo indigo purple purple pink pink red red orange orange yellow yellow green green teal teal cyan cyan white white gray gray gray-dark gray default;$theme-colors primary blue secondary gray success green info cyan warning yellow danger red light gray dark gray default; while updating a test project to v-beta i noticed that it isnt possible anymore to override the theme-colors properly to override theme-colors.primary one had to change the variable blue .would it be possible to introduce variables for the theme-colors which are then used in the color map this way one could override single elements of the theme colors without doing strange things like blue red or having to redefine the whole theme-colors map while making sure that all other used variables are already defined e.g green ).my suggestion is to do something like this: $primary blue default;$secondary gray default,$success green default,$info cyan default,$warning yellow default,$danger red default,$light gray default,$dark gray default$theme-colors primary primary secondary secondary success success info info warning warning danger danger light light dark dark default"
256506882,23899,https://api.github.com/repos/twbs/bootstrap/issues/23899,patrickhlauke,1,0,0,0,0,0,closes
256504061,23897,https://api.github.com/repos/twbs/bootstrap/issues/23897,speller,2,0,0,0,0,0,toggled button states are totally visually indistinguishable it is no way to tell the end user is button toggled or not do you plan to change it
256470822,23893,https://api.github.com/repos/twbs/bootstrap/issues/23893,frogydiak,1,0,0,0,0,0,mac os x chrome boostrap beta running npm test and i get an error on htmllint rc build/.htmllintrc gh_pages/*.html gh_pages/ /*.html js/tests/visual/*.html_gh_pages/index.html line col attribute names must match the format dash_gh_pages/index.html line col attribute names must match the format dash_gh_pages/index.html line col attribute names must match the format dashso i went ahead and edit build/.htmllintrc and changed: attr-name-style dashed to attr-name-style false just to test if the default value of dashed is the issue then rerun npm test again and i got: htmllint found errors out of fileslooking at gh_pages/index.html on the lines that were pointed out it is a class sizing mb it looks good to me maybe the attr-name-style value should not be dashed?thanks
